disease_name;description;resolve,,,,,,,,,
bight;terlihat bercak kecil, oval, kebasahan, kemudian bercak memanjang berbentuk elips, menjadi bercak nekrotik (kering) yang luas (hawar), berwarna hijau keabu-abuan atau coklat, dengan panjang hawar 2,"5 sampai 15 cm.;""Tanam varietas tahan seperti Kalingga", Arjuna, dan Hibrida Cl. 
Varietas jagung manis (sweet corn) sangat peka terhadap penyakit ini.,,,,,,,,,
Gray leaf spot;terjadi ketika muncul bercak daun berwarna hijau kekuningan atau cokelat kemerahan;menggunakan varietas tahan, seperti Bima 1, Sukmaraga, dan Palakka. Jika terlihat tanaman yang sudah terinfeksi maka harus segera dieradikasi. Dapat juga dilakukan pemberian fungisida dengan bahan aktif mancozeb dan carbendazim.,,,,,,
Common rust;terjadi ketika timbul bercak-bercak kecil berbentuk bulat sampai oval terdapat pada permukaan daun jagung di bagian atas dan bawah.;varietas tahan, seperti Lamuru, Sukmaraga, dan Semar 10. Jika terlihat tanaman yang sudah terinfeksi maka harus segera dieradikasi. Dapat juga dilakukan pemberian fungisida dengan bahan aktif benomil.,,,,,,
corn healthy;daunnya yang sempurna karena memiliki helai, pelepah, dan tangkai daun. Daun jagung punya tekstur yang licin atau berambut, dua tekstur utama dalam daunnya.;Spraying pesticides,,,,,,
